{
  "id": "purim",
  "version": "3.0",
  "parasha_en": "Purim",
  "parasha_he": "פּוּרִים",
  "holiday": true,
  "ref": "Megillat Esther (Esther 2–9)",
  "value": {
    "en": "Courage",
    "he": "אֹמֶץ לֵב",
    "kid_phrase": "being brave even when you feel scared",
    "gesture": "fists on hips, chin up"
  },
  "palette": [
    "#6D3FC0",
    "#2F6FB0",
    "#E0A526",
    "#3FA7A0",
    "#F5EBDD"
  ],
  "web_theme": {
    "primary": "#5B2D8E",
    "secondary": "#2F6FB0",
    "accent": "#E0A526",
    "wash": "#F6F0FB"
  },
  "story_world": "Shushan (Susa), capital of the ancient Achaemenid Persian Empire. The king's palace: tall slender fluted stone columns topped with twin-bull capitals, wide flat-roofed halls and porches, cedar-beam ceilings, wide stone staircases, walls of glazed brick in turquoise, gold and cream with rows of rosettes and friendly striding lions, stepped crenellated parapets, rich purple and blue hangings, gold cups and low couches. Doorways are tall and rectangular with flat lintels. Gardens with date palms, pomegranate trees and straight water channels; warm sandstone and cream plaster under a deep blue sky. Royal robes with wide sleeves and sashes; crenellated golden crowns; cloth head wraps. No pointed or horseshoe arches, no domes, no mosaic tilework, no Star of David.",
  "story_world_setting": "indoor",
  "week_plan": [
    {
      "day": 1,
      "label": "This card + Esther",
      "cards": [
        "anchor_1",
        "spotlight_1"
      ]
    },
    {
      "day": 2,
      "label": "Mordechai + Stories 1–2",
      "cards": [
        "spotlight_2",
        "story_1",
        "story_2"
      ]
    },
    {
      "day": 3,
      "label": "Story 3 + the Megillah",
      "cards": [
        "story_3",
        "tradition_1"
      ]
    },
    {
      "day": 4,
      "label": "Being brave + Purim giving",
      "cards": [
        "connection_1",
        "tradition_2",
        "tradition_3"
      ]
    },
    {
      "day": 5,
      "label": "Power word + Home card",
      "cards": [
        "power_word_1",
        "home_1"
      ]
    }
  ],
  "cards": [
    {
      "card_id": "anchor_1",
      "card_type": "anchor",
      "title_en": "Purim",
      "title_he": "פּוּרִים",
      "characters_in_scene": [],
      "image_prompt": "A magnificent golden Persian crown with a stepped, crenellated rim rests on a plush royal-purple velvet\ncushion with gold tassels at the corners. The burnished gold is set with tiny purple amethysts and\nturquoise stones, and a ring of small gold rosettes runs around the band. A soft purple silk veil is\ndraped half over one side of the cushion, as if something is hidden underneath.\nA single beam of warm golden light falls from above onto the crown; golden dust motes and soft sparkles\nfloat in the beam. The cushion rests in soft, warm darkness that glows deep purple and amber above,\nscattered with tiny stars. Faint tall stone columns fade into shadow at the far left and right edges.\nWONDER AND MYSTERY: whose crown is this, and what secret is hidden here?\n",
      "image_path": "raw/anchor_1.png",
      "back": {
        "objective": "**Being brave** even when you feel scared",
        "say": "[Hold the card up high] **Look at this crown! Who wears a crown?**\n**It belongs to Queen Esther. Esther had a secret… and one day she had to be very, very brave.**\n[Fists on hips, chin up] **Let's find out!**",
        "ask": [
          {
            "text": "What do you see on the crown?",
            "type": "wh"
          },
          {
            "text": "What do you think her secret is?",
            "type": "open"
          }
        ],
        "minutes": 3,
        "core": true,
        "transition": "Who is this queen with a secret?",
        "guide_ref": {
          "page": 2,
          "note": "hidden courage"
        }
      },
      "guide": {
        "pshat": {
          "text": "Purim tells how Queen Esther and her cousin Mordechai saved the Jewish people of the Persian Empire. The king put the royal crown on Esther's head and made her queen (2:17), but she did not tell anyone she was Jewish, because Mordechai told her not to (2:10). When the Jewish people needed her, she used her courage. We keep Purim on the 14th of Adar (15th in Jerusalem) (9:20-22).",
          "refs": [
            "Esther 2:10",
            "Esther 2:17",
            "Esther 9:20-22"
          ]
        },
        "sages": [
          {
            "text": "Our Sages teach that Esther's name is hinted at in the Torah's words 'I will surely hide (הַסְתֵּר אַסְתִּיר) My face.' Hashem's name never appears in the whole Megillah, yet Hashem was there, hidden, the whole time. Hidden courage, hidden help: that is the theme of this week.",
            "source": "Chullin 139b (on Deuteronomy 31:18)"
          }
        ],
        "hard_questions": [],
        "adapt": {
          "see": "Bring a real (toy) crown and a scarf; hide the crown under the scarf and reveal it.",
          "do": "Children who don't want to stand can do the brave gesture sitting: fists on hips, chin up.",
          "join": "Everyone can point to the crown, or nod when you ask 'Who wears a crown?'"
        },
        "extend": "Secret box: put a small Purim object in a closed box; children ask questions to guess what's hidden.",
        "tip": "Teach this week's courage gesture now (fists on hips, chin up) and use it every day, every time someone is brave."
      }
    },
    {
      "card_id": "spotlight_1",
      "card_type": "spotlight",
      "title_en": "Queen Esther",
      "title_he": "אֶסְתֵּר הַמַּלְכָּה",
      "characters_in_scene": [
        "esther"
      ],
      "image_prompt": "Esther, chest-up portrait, face centered, hands clasped gently near her heart, a quiet brave smile that\nhides a secret. Behind her a tall palace doorway with a rich blue curtain draped to one side and a\nglowing amber palace hall beyond. Warm golden light from the right lights her face.\nWarm, regal, kind: a queen with a secret that children instantly root for.\n",
      "image_path": "raw/spotlight_1.png",
      "back": {
        "objective": "Brave can mean scared, and doing it anyway",
        "say": "[Point to Esther's face] **This is Queen Esther. Sometimes Esther felt a little scared…**\n[Shaky hands] **…but she was brave anyway!** [Strong arms!]\n**Being brave means doing the right thing, even when you feel scared.**",
        "ask": [
          {
            "text": "How does Esther's face look?",
            "type": "wh"
          },
          {
            "text": "Show me your brave face!",
            "type": "nonverbal"
          }
        ],
        "hebrew": {
          "word": "אַמִּיצָה",
          "translit": "a-mee-TZAH",
          "meaning": "brave",
          "note": "for a boy: a-MEETZ אַמִּיץ",
          "gesture": "fists on hips, chin up"
        },
        "minutes": 3,
        "core": false,
        "transition": "Esther had a cousin who helped her…",
        "guide_ref": {
          "page": 4
        }
      },
      "guide": {
        "pshat": {
          "text": "Esther (her Hebrew name was Hadassah) had no father or mother. Her cousin Mordechai raised her as his own daughter (2:7). When she became queen she kept her people a secret, as Mordechai told her (2:10). Later she risked her life to save them (4:16).",
          "refs": [
            "Esther 2:7",
            "Esther 2:10",
            "Esther 4:16"
          ]
        },
        "sages": [],
        "hard_questions": [
          {
            "q": "Where were Esther's mommy and daddy?",
            "answer": "They weren't alive anymore, so her cousin Mordechai took care of her, like a dad.",
            "redirect": "Who takes care of you?"
          }
        ],
        "adapt": {
          "see": "Hold up two drawn faces, 'a little scared' and 'brave', and point to each as you say it.",
          "do": "Shaky hands and strong arms can be done sitting; children who don't want to move can nod.",
          "join": "Children can point to Esther, or show a brave face with no words."
        },
        "extend": "Brave chart: each time a child does something brave this week, add a sticker to a paper crown.",
        "tip": "Say אַמִּיצָה for Esther and אַמִּיץ for a boy; let children pick the word that fits them."
      }
    },
    {
      "card_id": "spotlight_2",
      "card_type": "spotlight",
      "title_en": "Mordechai",
      "title_he": "מָרְדֳּכַי",
      "characters_in_scene": [
        "mordechai"
      ],
      "image_prompt": "Mordechai, chest-up portrait, face centered, hands clasped calmly in front of him, a warm, gentle,\ngrandfatherly smile and crinkled kind eyes. He stands at the king's gate of ancient Persian Shushan:\nbehind him a tall straight-sided gateway with a flat stone lintel, flanked by thick mud-brick walls\nwith flat roofs. Along the wall runs a frieze of glazed bricks in turquoise and royal blue, with a\nstriding golden lion and a row of white-and-gold rosettes. A slender stone column topped with a\ntwin-bull capital stands at one side. Through the gateway, date palms and flat-roofed sandstone houses.\nBright blue sky above the flat-topped walls, warm afternoon light on his face. No domes, no pointed or\nrounded arches anywhere: every opening is rectangular with a flat lintel.\nWise, trustworthy, solid: like a favorite grandfather who always knows the right thing to do.\n",
      "image_path": "raw/spotlight_2.png",
      "back": {
        "objective": "Mordechai cared for Esther and helped her be brave",
        "say": "[Point to Mordechai] **This is Mordechai, Esther's cousin. He took care of Esther, like a dad.** [Hug yourself]\n**Later he told her: \"Who knows? Maybe you became queen for just this time!\"** [Tap your head: think!]",
        "ask": [
          {
            "text": "Who gives you good advice?",
            "type": "open"
          },
          {